{
  "$schema": "https://json-schema.org/draft/2020-12/schema",
  "$id": "https://forgerail.dev/schemas/effective-profile-v1.json",
  "title": "ForgeRail Effective Profile",
  "type": "object",
  "additionalProperties": false,
  "required": ["schemaVersion", "workspace", "computed", "rules", "packs", "conflicts"],
  "properties": {
    "schemaVersion": { "const": "1.0" },
    "workspace": { "type": "string", "minLength": 1 },
    "computed": { "const": true },
    "rules": {
      "type": "array",
      "items": {
        "type": "object",
        "additionalProperties": false,
        "required": ["id", "value", "source", "precedence", "status"],
        "properties": {
          "id": { "type": "string", "pattern": "^[a-z][a-z0-9.-]+$" },
          "value": {},
          "source": { "type": "string", "minLength": 1 },
          "precedence": { "type": "integer", "minimum": 1, "maximum": 6 },
          "status": { "enum": ["observed", "inferred", "confirmed", "default"] }
        }
      }
    },
    "packs": {
      "type": "object",
      "propertyNames": { "pattern": "^[a-z][a-z0-9-]+$" },
      "additionalProperties": {
        "type": "object",
        "additionalProperties": false,
        "required": ["state", "reason"],
        "properties": {
          "state": { "enum": ["available", "recommended", "enabled", "required", "blocked", "disabled"] },
          "reason": { "type": "string", "minLength": 1 }
        }
      }
    },
    "conflicts": { "type": "array", "items": { "type": "string", "minLength": 1 } }
  }
}
